اسم الخدمة,خطوات الخدمة,المستندات المطلوبة,سعر الخدمة,متطلبات الخدمة,صفة المستخدم
مواعيد الأمن العام,تسجيل الدخول إلى موقع منصة أبشر اختيار مواعيد اختيار الأمن العام اختيار خدمة حجز موعد اختيار المنطقة أو الإدارة المعنية تحديد نوع الخدمة المطلوبة اختيار التاريخ والوقت المناسب للحجز تأكيد حجز الموعد,1- أن يكون لدى المستفيد موعد محجوز مسبقًا لتنفيذ الخدمة المطلوبة. 2- في حال وجود موعد قائم يمكن تعديله أو إلغاؤه قبل الموعد المحدد. 3- طباعة الموعد أو الاحتفاظ به إلكترونيًا لإبرازه عند الحضور إلى الفرع. 4- إلغاء أي موعد سابق قبل حجز موعد جديد لنفس الخدمة.,مجانية,أن يكون لدى المستفيد هوية رقمية في منصة أبشر. اختيار الخدمة والفرع المناسب قبل تأكيد الحجز. الالتزام بالحضور في الموعد المحدد. إحضار الوثائق المطلوبة لكل خدمة بحسب الجهة المختصة.,غير متوفر
الاستعلام العام عن رخص السلاح الناري,1- تسجيل الدخول إلى موقع منصة أبشر 2- اختيار خدماتي 3- اختيار استعلامات 4- اختيار الأمن العام 5- اختيار الاستعلام عن رخصة السلاح 6- إدخال البيانات المطلوبة 7- الضغط على عرض 8- ستظهر لك تفاصيل رخصة السلاح,1- أن يكون لدى المستفيد هوية رقمية في منصة أبشر. 2- وجود سلاح ناري.,مجانية,1- عدم وجود ملاحظات أمنية. 2- أن يكون السلاح المراد إصدار إذن التنقل له من ضمن رخصة الاقتناء فقط.,غير متوفر
نقل ملكية سلاح,1- تسجيل الدخول إلى موقع منصة أبشر 2- اختيار خدماتي 3- اختيار الأمن العام 4- اختيار إدارة الأسلحة 5- اختيار خدمات السلاح 6- اختيار نقل ملكية السلاح 7- استكمال البيانات المطلوبة الخاصة بالمالك الجديد 8- مراجعة تفاصيل الطلب والتأكد من صحتها 9- تأكيد طلب نقل الملكية 10- ستظهر رسالة تؤكد تقديم الطلب بنجاح,إجراء الفحص الطبي من (إفادة). إجراء الفحص الطبي من قبل المالك الجديد. تسجيل معلومات المالك الجديد. دفع رسوم الخدمة من المالك الحالي لتأكيد نقل السلاح. نقل ملكية السلاح بالنظام للمالك الجديد.,172,عدم حمل السلاح داخل الحرمين الشريفين. حفظ السلاح المرخص بالاقتناء في مكان آمن. عدم حمل السلاح بالقرب من المناطق الحكومية والأمنية. الحصول على تصريح تنقل عند التنقل بأسلحة الاقتناء. الإبلاغ عن السلاح في حال السرقة. عدم وجود ملاحظات أمنية. أن يكون السلاح المراد إصدار إذن التنقل له من ضمن رخصة الاقتناء فقط. لا يمكن حمل أكثر من سلاح واحد واقتناء أكثر من عشرة أسلحة. أن تكون الرخصة للمالك الحالي والمالك الجديد سارية المفعول.,غير متوفر
تجديد رخصة سلاح,تسجيل الدخول إلى موقع منصة أبشر اختيار خدماتي اختيار خدمات الأمن العام اختيار تجديد رخصة سلاح ناري تحديد نوع الرخصة وتأكيد البيانات سداد الرسوم,فحص طبي ساري. سداد رسوم التجديد. عدم وجود ملاحظات أمنية على المستفيد.,172,أن تكون المدة المتبقية على انتهاء الرخصة أقل من 90 يومًا. عدم وجود ملاحظات أمنية. أن يكون السلاح المراد إصدار إذن التنقل له من ضمن رخصة الاقتناء فقط.,غير متوفر
إذن التنقل بالسلاح الناري,1- تسجيل الدخول إلى موقع منصة أبشر 2- اختيار خدماتي 3- اختيار الأمن العام 4- اختيار إدارة الأسلحة 5- استعراض الخدمات المتاحة 6- اختيار الخدمة المطلوبة 7- تعبئة البيانات المطلوبة حسب نوع الخدمة 8- تأكيد الطلب,1- يجب تحديد: مسار التنقل المنطقة تاريخ بداية التصريح عدد الذخائر - الإقرار وقبول شروط الخدمة. 2- دفع رسوم الخدمة.,57,1- أن يكون لدى المستفيد هوية رقمية في منصة أبشر. 2- عدم وجود ملاحظات أمنية. 3- أن يكون السلاح المراد إصدار إذن التنقل له من ضمن رخصة الاقتناء فقط. 4- لا يمكن حمل أكثر من سلاح واحد واقتناء أكثر من عشرة أسلحة. 5- يمكن شراء الأسلحة من الملاك أو المراكز المعتمدة.,غير متوفر
مواعيد مراجعة الشُرط,تسجيل الدخول إلى موقع منصة أبشر اختيار الخدمات الإلكترونية اختيار مواعيد اختيار الشرطة اختيار حجز موعد اختيار المنطقة والإدارة المطلوبة تحديد الخدمة وتعبئة البيانات المطلوبة اختيار التاريخ والوقت المناسب من المواعيد المتاحة تأكيد الحجز,في حال وجود موعد قائم يمكن تعديله أو إلغاؤه قبل الموعد المحدد. طباعة الموعد أو الاحتفاظ به إلكترونيًا لإبرازه عند الحضور إلى الفرع.,مجانية,أن يكون لدى المستفيد موعد محجوز مسبقًا لتنفيذ الخدمة المطلوبة. إلغاء أي موعد سابق قبل حجز موعد جديد لنفس الخدمة.,غير متوفر
الاستعلام العام عن رخصة البنادق الهوائية,1- تسجيل الدخول إلى موقع منصة أبشر 2-اختيار خدماتي 3- اختيار استعلامات 4- اختيار الأمن العام 5-اختيار الاستعلام عن رخصة السلاح 6- استعراض بيانات رخصة البندقية الهوائية,1- أن تكون رخصة السلاح الهوائي صادرة باسم المستفيد. 2- توفر بيانات صحيحة ومحدثة في حساب المستفيد.,مجانية,أن يكون لدى المستفيد هوية رقمية في منصة أبشر.,غير متوفر
بلاغات الجرائم المعلوماتية,1-تسجيل الدخول للتطبيق 2- اختيار تصنيف الجرائم المعلوماتية 3- اختيار التصنيف الفرعي 4- اضافة الوصف والمرفقات وارسال البلاغ,1- تسجيل الدخول برقم الهوية او الاقامة 2- رفع البلاغ والاقرار بصحة المعلومات,مجانية,1- تسجيل الدخول للتطبيق 2- الموافقة على الشروط 3- الاقرار بصحة البيانات المرفوعة,غير متوفر
بلاغات الاحتيال المالي,1- تسجيل الدخول إلى منصة أبشر 2- اختيار خدماتي 3- اختيار الأمن العام 4- اختيار بلاغات الاحتيال المالي 5- تعبئة نموذج البلاغ وإدخال التفاصيل المطلوبة 6- إرسال البلاغ للمراجعة والمتابعة,1- أن يكون لدى المستفيد هوية رقمية في منصة أبشر. 2- توفر معلومات دقيقة حول الحادثة.,مجانية,1- لا يُقبل تكرار البلاغ إذا تم استخدام نفس المعلومات المدخلة سابقًا. 2- يُسمح بتصحيح البلاغ 3 مرات فقط ثم يُغلق تلقائيًا. 3- إذا كانت حالة البلاغ معاد للتصحيح ولم يتم التصحيح خلال أسبوعين يُغلق البلاغ ويُعرض كـ ملغي. 4- تقتصر الخدمة على حالات الاحتيال المالي فقط وفي حال وجود مطالبة مالية يجب مراجعة الجهة المختصة حسب نوع الحالة,غير متوفر
